{
  "schema": "moat.event.v1",
  "event_id": "ev-arch-desk-901",
  "kind": "flow_decision",
  "producer": "moatd",
  "authority": "endpoint_enforcer",
  "device_id": "arch-desk",
  "boot_id": "6f1c2a8e-boot",
  "sequence": 901,
  "event_time": "2026-10-27T15:00:01Z",
  "ingest_time": "2026-10-27T15:00:03Z",
  "clock_uncertainty_ms": 250,
  "subject": {
    "schema": "moat.subject.v1",
    "device_id": "arch-desk",
    "boot_id": "6f1c2a8e-boot",
    "task_id": "20261027150000-a1b2c3d4e5f6"
  },
  "subject_confidence": "high",
  "destination": {
    "address": "203.0.113.9",
    "port": 443,
    "transport": "tcp",
    "hostname": {
      "name": "oss-cn-beijing.aliyuncs.com",
      "source": "sni",
      "confidence": "medium"
    }
  },
  "generations": {
    "policy_revision": 12,
    "effective_digest": "sha256:3333333333333333333333333333333333333333333333333333333333333333",
    "capability_generation": 3
  },
  "decision": {
    "verdict": "deny",
    "winner": "rule:safety-no-alibaba",
    "overridden": [
      "rule:coding-allow-any-443"
    ]
  },
  "measurements": [
    {
      "name": "packets_dropped",
      "value": 3,
      "unit": "packets",
      "scope": "rule_counter",
      "source": "nftables_counter"
    }
  ]
}
